{
  "$schema": "https://json-schema.org/draft/2020-12/schema",
  "$id": "https://software-factory-agents/contracts/agents/design_brief_agent.output.schema.json",
  "title": "design_brief_agent Output",
  "type": "object",
  "additionalProperties": false,
  "required": [
    "status",
    "artifacts",
    "payload",
    "handoff"
  ],
  "properties": {
    "status": {
      "type": "string",
      "enum": [
        "success",
        "failed"
      ]
    },
    "summary": {
      "type": "string"
    },
    "artifacts": {
      "type": "array",
      "items": {
        "$ref": "../common/artifact_metadata.schema.json"
      }
    },
    "payload": {
      "type": "object",
      "additionalProperties": false,
      "required": [
        "design_brief",
        "inspirations"
      ],
      "properties": {
        "design_brief": {
          "type": "array",
          "minItems": 1,
          "items": {
            "type": "string",
            "minLength": 1
          }
        },
        "inspirations": {
          "type": "array",
          "items": {
            "type": "object",
            "additionalProperties": false,
            "required": [
              "type",
              "comment"
            ],
            "properties": {
              "type": {
                "type": "string",
                "enum": [
                  "link",
                  "image",
                  "comment"
                ]
              },
              "value": {
                "type": "string"
              },
              "comment": {
                "type": "string",
                "minLength": 1
              }
            }
          }
        }
      }
    },
    "handoff": {
      "type": "object",
      "additionalProperties": false,
      "required": [
        "next_stage",
        "next_agent",
        "payload"
      ],
      "properties": {
        "next_stage": {
          "type": "string",
          "const": "design"
        },
        "next_agent": {
          "type": "string",
          "const": "ui_design_agent"
        },
        "payload": {
          "type": "object",
          "required": [
            "design_brief",
            "inspirations"
          ],
          "properties": {
            "design_brief": {
              "type": "array",
              "items": {
                "type": "string",
                "minLength": 1
              }
            },
            "inspirations": {
              "type": "array",
              "items": {
                "type": "object",
                "additionalProperties": false,
                "required": [
                  "type",
                  "comment"
                ],
                "properties": {
                  "type": {
                    "type": "string",
                    "enum": [
                      "link",
                      "image",
                      "comment"
                    ]
                  },
                  "value": {
                    "type": "string"
                  },
                  "comment": {
                    "type": "string",
                    "minLength": 1
                  }
                }
              }
            }
          }
        }
      }
    },
    "failure": {
      "$ref": "../common/failure.schema.json"
    }
  },
  "allOf": [
    {
      "if": {
        "properties": {
          "status": {
            "const": "failed"
          }
        },
        "required": [
          "status"
        ]
      },
      "then": {
        "required": [
          "failure"
        ]
      }
    }
  ]
}
